{
  "id": "66815379-cdaf-4883-b05a-fd726426fdcf",
  "name": "Printer Paper",
  "description": "8.5\" x 11\" Copy Paper, 20 lbs, 92 Brightness, 5000/Carton (324791)",
  "lineNumber": 1,
  "productCode": "Tuna-181",
  "productName": "Handcrafted Frozen Tuna",
  "orderedQuantity": 20.0,
  "quantityUnitOfMeasure": "case",
  "unitPrice": 34.45,
  "requestedStartDate": null,
  "requestedEndDate": null,
  "productDeliveryLocation": {
    "id": null,
    "name": "Customer Address",
    "contactName": "Samuel L. Smith",
    "locationCode": "338",
    "locationAddress": {
      "addressLine1": "2122 Maple Street",
      "addressLine2": "Unit 23",
      "addressLine3": "",
      "cityName": "Austin",
      "stateProvinceCode": "TX",
      "countryCode": "US",
      "postalCodeText": "45145"
    }
  },
  "auditInfo": {
    "createdBy": "Application Admin",
    "createdDate": "2023-12-12T19:24:05Z",
    "updatedBy": "Application Admin",
    "updatedDate": "2023-12-12T19:24:05Z",
    "isDeleted": false
  }
}